[
  {
    "id": "software-software-engineer-ai-engineer",
    "discipline": "Software",
    "layer": "Operational",
    "was": "Software engineer",
    "becomes": "AI engineer",
    "morph": "Shipping code to shipping evals and context",
    "evidence_type": "Job posting",
    "source_url": "https://www.anthropic.com/careers/jobs",
    "note": null,
    "employer": null,
    "date_observed": "2026-09"
  },
  {
    "id": "software-infrastructure-engineering-inference-engineering",
    "discipline": "Software",
    "layer": "Operational",
    "was": "Infrastructure engineering",
    "becomes": "Inference engineering",
    "morph": "Keeping servers up to keeping tokens cheap",
    "evidence_type": "Job posting",
    "source_url": "https://www.anthropic.com/careers/jobs",
    "note": "Anthropic lists Performance Engineer, Inference Systems and EM, GPU (ML Accelerator)",
    "employer": null,
    "date_observed": "2026-09"
  },
  {
    "id": "software-qa-rl-environment-design",
    "discipline": "Software",
    "layer": "Operational",
    "was": "QA",
    "becomes": "RL environment design",
    "morph": "Labs buy 10-20 environments at a time, for millions",
    "evidence_type": "Job posting",
    "source_url": "https://openai.com/careers/agent-post-training-frontier-evals-and-environments-research-san-francisco/",
    "note": "A supplier industry now exists: Idler, Turing, Mercor/Deeptune. Market figure via Nathan Lambert.",
    "employer": null,
    "date_observed": "2026-09"
  },
  {
    "id": "software-solutions-engineer-fde",
    "discipline": "Software",
    "layer": "Operational",
    "was": "Solutions engineer",
    "becomes": "FDE",
    "morph": "Configuring a product to building inside the customer",
    "evidence_type": "Job posting",
    "source_url": "https://openai.com/careers/forward-deployed-engineer-%28fde%29-sf-san-francisco/",
    "note": null,
    "employer": null,
    "date_observed": "2026-09"
  },
  {
    "id": "software-debugging-mechanistic-interpretability",
    "discipline": "Software",
    "layer": "Decision",
    "was": "Debugging",
    "becomes": "Mechanistic interpretability",
    "morph": "Reading logs to reading weights",
    "evidence_type": "Research team page",
    "source_url": "https://www.anthropic.com/research/team/interpretability",
    "note": "The tell is the hiring pool: the team recruits from astronomy, physics, mathematics and biology.",
    "employer": null,
    "date_observed": "2026-09"
  },
  {
    "id": "software-issue-hypothesis",
    "discipline": "Software",
    "layer": "Decision",
    "was": "Issue",
    "becomes": "Hypothesis",
    "morph": "Fixing the known to testing the unknown",
    "evidence_type": "Job posting",
    "source_url": "https://openai.com/careers/agent-post-training-frontier-evals-and-environments-research-san-francisco/",
    "note": "Verbatim in the job description: turn qualitative behavior into concrete hypotheses, experiments and fixes.",
    "employer": null,
    "date_observed": "2026-09"
  },
  {
    "id": "product-product-manager-ai-builder",
    "discipline": "Product",
    "layer": "Operational",
    "was": "Product manager",
    "becomes": "AI builder",
    "morph": "Writing the spec to running the prototype",
    "evidence_type": "Industry reporting",
    "source_url": "https://x.com/lennysan/status/2102422882341322779",
    "note": "Nearly half of 25 listed PM roles ask for eval experience. Small sample.",
    "employer": null,
    "date_observed": "2026-09"
  },
  {
    "id": "product-product-design-model-behaviour",
    "discipline": "Product",
    "layer": "Decision",
    "was": "Product design",
    "becomes": "Model behaviour",
    "morph": "Designing the interface to designing the disposition",
    "evidence_type": "Job posting",
    "source_url": "https://openai.com/careers/research-engineer-research-scientist-model-behavior",
    "note": "The team describes itself as expert tastemakers, designers, PMs and researchers.",
    "employer": null,
    "date_observed": "2026-09"
  },
  {
    "id": "product-analytics-and-insights-behavioural-models",
    "discipline": "Product",
    "layer": "Decision",
    "was": "Analytics & insights",
    "becomes": "Behavioural models",
    "morph": "Reporting the past to simulating the population",
    "evidence_type": "Named study",
    "source_url": "https://arxiv.org/abs/2411.10109",
    "note": "Agents built from two-hour interviews with 1,052 Americans.",
    "employer": null,
    "date_observed": "2026-09"
  },
  {
    "id": "product-partner-embedded-evaluator",
    "discipline": "Product",
    "layer": "Decision",
    "was": "Partner",
    "becomes": "Embedded evaluator",
    "morph": "Implementation hours to judging behaviour",
    "evidence_type": "Industry reporting",
    "source_url": "https://x.com/HamelHusain/status/2079938784205140175",
    "note": "n=25+ companies, first-hand. No market data on evals-as-a-service.",
    "employer": null,
    "date_observed": "2026-09"
  },
  {
    "id": "product-product-agent",
    "discipline": "Product",
    "layer": "Structural",
    "was": "Product",
    "becomes": "Agent",
    "morph": "Interface to behaviour, seats to resolutions",
    "evidence_type": "Industry reporting",
    "source_url": "https://sierra.ai/blog/outcome-based-pricing-for-ai-agents",
    "note": null,
    "employer": null,
    "date_observed": "2026-09"
  },
  {
    "id": "science-bench-scientist-autonomous-lab-supervisor",
    "discipline": "Science",
    "layer": "Operational",
    "was": "Bench scientist",
    "becomes": "Autonomous lab supervisor",
    "morph": "Running the experiment to overseeing the robot that runs it",
    "evidence_type": "Industry reporting",
    "source_url": "https://www.nature.com/collections/cgbiacfcgc",
    "note": "Nature: humans were always pulling the strings. Now that paradigm is changing.",
    "employer": null,
    "date_observed": "2026-09"
  },
  {
    "id": "science-lab-automation-ai-lab-innovation",
    "discipline": "Science",
    "layer": "Operational",
    "was": "Lab automation",
    "becomes": "AI-lab innovation",
    "morph": "Scripting instruments to closing the hypothesis loop",
    "evidence_type": "Job posting",
    "source_url": "https://www.lila.ai",
    "note": "VP, Head of AI-Lab Innovation is a named role.",
    "employer": null,
    "date_observed": "2026-09"
  },
  {
    "id": "science-postdoc-ai-paired-researcher",
    "discipline": "Science",
    "layer": "Operational",
    "was": "Postdoc",
    "becomes": "AI-paired researcher",
    "morph": "Learning the bench to directing agents",
    "evidence_type": "Industry reporting",
    "source_url": "https://www.futurehouse.org/",
    "note": "AI-for-Science Independent Postdoctoral Fellowship.",
    "employer": null,
    "date_observed": "2026-09"
  },
  {
    "id": "science-reading-the-literature-understanding-extraction",
    "discipline": "Science",
    "layer": "Operational",
    "was": "Reading the literature",
    "becomes": "Understanding extraction",
    "morph": "Absorbing findings to reverse-engineering why the machine was right",
    "evidence_type": "Argued only",
    "source_url": "https://www.normaltech.ai/p/what-will-be-left-for-us-to-work",
    "note": "Narayanan's prediction, not an observed role. Human understanding is not friction to be automated away.",
    "employer": null,
    "date_observed": "2026-09"
  },
  {
    "id": "science-experiment-design-open-ended-search",
    "discipline": "Science",
    "layer": "Decision",
    "was": "Experiment design",
    "becomes": "Open-ended search",
    "morph": "Picking the next test to defining the space to search",
    "evidence_type": "Industry reporting",
    "source_url": "https://www.lila.ai",
    "note": "Lila runs an Open-Endedness team under Ken Stanley.",
    "employer": null,
    "date_observed": "2026-09"
  },
  {
    "id": "legal-practice-innovation-director-of-ai",
    "discipline": "Legal",
    "layer": "Structural",
    "was": "Practice innovation",
    "becomes": "Director of AI",
    "morph": "Sixteen firms hiring 25+ AI leads; Pillsbury pays up to $440K",
    "evidence_type": "Industry reporting",
    "source_url": "https://news.bloomberglaw.com/business-and-practice/the-hottest-job-at-big-law-firms-is-becoming-difficult-to-fill",
    "note": "Bloomberg Law, 2 Jul 2026: the director of AI is Big Law's hot new job. Pillsbury, director of data science and AI engineering, up to $440K; Covington, director of applied AI, up to $438K; Gibson Dunn up to $380K. Pillsbury named its first chief AI officer in July 2026.",
    "employer": null,
    "date_observed": "2026-09"
  },
  {
    "id": "legal-document-review-audit-sampling",
    "discipline": "Legal",
    "layer": "Operational",
    "was": "Document review",
    "becomes": "Audit sampling",
    "morph": "Reading everything to checking a model that read everything",
    "evidence_type": "Industry reporting",
    "source_url": "https://imanage.com/resources/resource-center/blog/how-law-firms-are-adapting-to-the-age-of-ai/",
    "note": "Adopted early, well before AI touched legal judgment.",
    "employer": null,
    "date_observed": "2026-09"
  },
  {
    "id": "legal-practising-attorney-legal-engineer",
    "discipline": "Legal",
    "layer": "Decision",
    "was": "Practising attorney",
    "becomes": "Legal engineer",
    "morph": "Harvey pays $220-320K for lawyers who left practice",
    "evidence_type": "Job posting",
    "source_url": "https://www.harvey.ai/company/careers/f4d70ed0-010e-40f5-b194-2813e55f6e0c",
    "note": "Harvey lists it at $220-320K, staffed by lawyers who left practice. Firm Prospects counted 46 lawyers leaving Am Law 200 firms for AI companies in the first half of 2026.",
    "employer": null,
    "date_observed": "2026-09"
  },
  {
    "id": "legal-apprenticeship-on-live-matters-case-simulator",
    "discipline": "Legal",
    "layer": "Structural",
    "was": "Apprenticeship on live matters",